{"capture_image_id":"sha256:d2976a55253100d3cf2382ac3a8dc9862d4457ad1397481b8e75c254ad4a858c","capture_image_reference":"sha256:d2976a55253100d3cf2382ac3a8dc9862d4457ad1397481b8e75c254ad4a858c","capture_tool_version":"4.0.17","compatibility_decision":{"reason":"source, lock, and image-lock identities are compatible","status":"compatible"},"docker_compose_version":"5.5.0","docker_engine_version":"29.7.2","host_architecture":"x86_64","kernel_release":"6.18.33.2-microsoft-standard-WSL2","python_implementation":"CPython","python_version":"3.12.3","scientific_artifact_schema":4,"source_commit":"ab10cb15e90a9e306f941ebacf10247821e458b3","source_tree":"43ac13b8e510d447bc67b4ed559b7337f8f46a2d","target_image_id":"sha256:d9b4541e214bcd85196d6e92e2753ac6d0ea699f0af5741f8c6cccbfcf00ef4b","target_image_reference":"curlimages/curl@sha256:d9b4541e214bcd85196d6e92e2753ac6d0ea699f0af5741f8c6cccbfcf00ef4b","uv_lock_identity":{"sha256":"b11e9c4f8ec7e0110b0c9823aadcb17b309bddd4a48fbc5ad41c7794d9219357","size":104376}}
